text,label
set internal clock fiji time exploring archipelago exquisite beach undersea marvel lush interior fascinating culture,travel
rushed go dreaming planning trip planning option made help craft ideal itinerary forest park suva,travel
pronounced oasis lush rainforest teeming tropical plant vivid melodic bird life fiji museum suva museum,travel
offer great journey fiji historical cultural evolution enjoy exhibit chronological order start suva municipal market,travel
suva beating heart suva great place spend hour poking around camera boy barrow lane sri,travel
siva subramaniya swami temple nadi riotously bright hindu temple one place outside india see traditional,travel
dravidian architecture wooden carving mariamma temple suva south indian festival held july august fiji cultural,travel
ritual extraordinary art fire walking tavuni hill fort coral coast although many fort like scattered,travel
fiji tavuni hill fort accessible visitor built th century parliament fiji suva opened june,travel
parliament complex must one world striking political hub designed atmosphere tavoro waterfall taveuni framed thick,travel
ridiculously green jungle three waterfall also known bouma fall epitomise island epithet taveuni beachcomber island,travel
resort mamanuca group resort wonderful oddity beloved backpacker atmosphere huge somehow airy even  bed,travel
dorm fiji paradise must northern viti levu itinerary beautifully hilly island surrounded scalloped bay cave,travel
yasawa group odd limestone island amid string high volcanic island underwater limestone thought formed hundred,travel
sri siva subramaniya swami temple nadi riotously bright hindu temple one place outside india see,travel
traditional dravidian architecture wooden carving namena marine reserve savusavu around protected sqkm park housing coral,travel
vibrant marine life plentiful become poster child fiji underwater world garden sleeping giant nadi suva,travel
viti levu garden spot absolute botanic bonanza abloom  variety orchid plus indigenous flora suva,travel
municipal market suva beating heart suva great place spend hour poking around camera boy barrow,travel
lane best thing tempting never leave beach fabulous fiji promise worth  incredible experience ca,travel
miss thing know wondering need know going fiji insider tip reveal pack go safety advice,travel
kava etiquette transportation public bus helicopter charter myriad way see fiji depending time budget visa,travel
requirement ready paradise plan next fiji vacation without hitch using guide latest visa requirement money,travel
cost visiting fiji want break bank save money food accommodation day tour transportation traveling kid,travel
get know make fiji one world destination guide visiting child best road trip instead traveling,travel
boat plane take set wheel experience best fiji incredible road trip filter interest interest activity,travel
jan    min read get know make fiji one world destination guide visiting,travel
child oct    min read oct    min read oct,travel
min read oct    min read oct    min,travel
read oct    min read oct    min read oct,travel
min read oct    min read partnership getyourguide get heart fiji,travel
one guidebook covering map itinerary expert guidance explorer everywhere  lonely planet red venture company,travel
right reserved part site may reproduced without written permission english image paris boulevard museum classical,travel
bistro boutique enhanced new itinerary expert guidance explorer everywhere  lonely planet red venture company,travel
right reserved part site may reproduced without written permission english pakistan blessed abundant natural historical,travel
rich incredible mountain landscape set backdrop desert fort story sultan djinn city ancient bazaar home,travel
intricately etched copper kitchenware alongside pungent spice rack steaming tea stall go dreaming planning trip,travel
planning option made help craft ideal itinerary lahore fort lahore built damaged demolished rebuilt restored,travel
several time given current form emperor akbar  made lahore smuggler bazaar peshawar fringe peshawar,travel
head towards khyber pas smuggler bazaar karkhanai bazaar thrives openly sale shah faisal mosque islamabad,travel
rawalpindi shah faisal mosque nestled foot margalla hill one asia largest reflects eclectic blend ultramodern,travel
badshahi mosque lahore completed  aurangzeb mughals final architectural fling sublime badshahi mosque opposite main,travel
gateway lahore fort jehangir tomb lahore standing garden northern outskirt lahore elaborately decorated sandstone jehangir,travel
tomb emperor jehangir built uprising memorial gilgit uprising memorial memorial rose maharaja  includes graf,travel
local hero mohammed babar khan baltit fort karakoram highway oldest part baltit fort date th,travel
century year house tower added fortified cement shrine data ganj bakhsh hajveri lahore author famous,travel
book mysticism data ganj bakhsh originally ghazni afghanistan one successful shrine monument pakistan enthusiastic fan,travel
islamic architecture could fully appreciate multan shrine tomb mosque fleeting visit many badshahi mosque lahore,travel
completed  aurangzeb mughals final architectural fling sublime badshahi mosque opposite main gateway lahore fort,travel
lok virsa museum islamabad rawalpindi lok virsa museum house fascinating array traditional handicraft including embroidered,travel
costume old jewellery intricate woodcarving mausoleum karachi curiously shaped mausoleum monument pakistan founder mohammed ali,travel
jinnah set top stepped pyramid small park best thing hiking epic landscape touring museum sampling,travel
street food best thing visit pakistan thing know pakistan thrilling destination travel challenging unprepared need,travel
know visit transportation information public transport pakistan difficult find online everything need know getting around,travel
arrive visa requirement pakistan adventurous destination getting easier visit time need know getting visa money,travel
cost pakistan one asia affordable destination budget travel tip save flight accommodation food traveling kid,travel
follow insider tip find pakistan great place travel kid best road trip whether drive hire,travel
car driver pakistan spectacular place take road trip pick pakistan best drive filter interest interest,travel
tip advice sep    min read pakistan adventurous destination getting easier visit time,travel
need know getting visa sep    min read sep    min,travel
read sep    min read aug    min read aug,travel
min read aug    min read aug    min,travel
read aug    min read dec    min read partnership getyourguide,travel
get heart pakistan one guidebook covering map itinerary expert guidance explorer everywhere  lonely planet,travel
red venture company right reserved part site may reproduced without written permission english sylwia bartyzel,travel
sumptuous mix tradition spiritual belief festival architecture landscape india set memory ablaze long left shore,travel
experience real india let local expert handle planning jodhpur rising perpendicular impregnable rocky hill stand,travel
m jodhpur skyline mehrangarh one magnificent fort taj mahal agra poet rabindranath tagore described teardrop,travel
cheek eternity rudyard kipling embodiment thing pure creator city palace jaipur complex courtyard garden building,travel
impressive city palace right centre old city outer wall built jai amber fort eastern rajasthan,travel
magnificent fort comprises extensive palace complex built pale yellow pink sandstone white marble divided four,travel
sun temple odisha conceived cosmic chariot sun god surya massive breathtakingly splendid temple constructed century,travel
probably brihadeeshwara temple thanjavur tanjore come twice morning granite begin assert dominance white dawn sunshine,travel
evening golden temple amritsar legendary golden temple actually small part huge gurdwara complex known sikh,travel
harmandir sahib spiritually focus mehrauli archaeological park delhi extraordinary rich scattered around mehrauli  monument,travel
th century british era dotting forest dashashwamedh ghat varanasi varanasi liveliest colourful ghat name indicates,travel
brahma sacrificed medh  da horse aswa spite chandni chowk old delhi shahjahanabad old delhi,travel
main drag lined jain hindu sikh temple plus church fatehpuri masjid one end elegant kaziranga,travel
national park assam park  rhino represent world total population   kaziranga offer popular,travel
golden temple amritsar legendary golden temple actually small part huge gurdwara complex known sikh harmandir,travel
sahib spiritually focus sundarbans tiger reserve west bengal sundarbans tiger reserve royal bengal tiger lurking,travel
impenetrable mangrove forest sometimes swimming amrit sarovar amritsar spiritually focus attention within golden temple complex,travel
tank surround gleaming central shrine known amrit sarovar bandipur national park karnataka park cover,travel
sq km mysore maharaja private wildlife reserve noted herd gaur indian bison chitals devaraja market,travel
mysuru mysore dating tipu sultan reign huge lively bazaar local trader selling traditional item flower,travel
garland incense spice vittala temple hampi hampi exquisite structure vittala temple stand amid boulder hampi,travel
bazaar work possibly started temple mudumalai tiger reserve western ghat foothill nilgiris newly enlarged wildlife,travel
reserve like classical indian landscape painting given life dudhsagar fall panaji central goa situated far,travel
southeastern corner bhagwan mahavir wildlife sanctuary goa impressive waterfall splash west assi ghat varanasi furthest,travel
south main ghat one biggest assi ghat particularly important river assi meet ganges near manikarnika,travel
ghat varanasi manikarnika ghat main burning ghat auspicious place hindu cremated dead body handled outcast,travel
known doms nagarhole national park karnataka west kabini river wildlife sanctuary nagarhole national park pronounced,travel
lush forest home bhagwan mahavir wildlife sanctuary panaji central goa entrance bhagwan mahavir wildlife sanctuary,travel
easily accessible molem area  sq km largest goa airavatesvara temple tamil nadu three kilometre,travel
west kumbakonam shiva temple constructed raja raja ii step rajagambhira hall hemis national park ladakh,travel
hemis national park cover roadless village rumbak yurutse whole markha valley pass access trail stok,travel
trekking virupaksha temple hampi focal point hampi bazaar temple one city oldest structure hampi remaining,travel
working temple main gopuram gateway gangaikonda cholapuram temple tamil nadu temple gangaikonda cholapuram chola conquered,travel
ganges km north kumbakonam dedicated shiva built pench tiger reserve madhya pradesh chhattisgarh pench made,travel
mostly forest rather sal different flavour nearby kanha bandhavgarh also see fewer kanha tiger reserve,travel
madhya pradesh chhattisgarh madhya pradesh king jungle come tiger park kanha famous forest vast chance,travel
agra nicknamed baby taj exquisite tomb mizra ghiyas beg missed persian nobleman mumtaz mahal grandfather,travel
mehrangarh jodhpur rising perpendicular impregnable rocky hill stand m jodhpur skyline mehrangarh one magnificent fort,travel
corbett tiger reserve uttarakhand famous reserve established  india first national park originally called hailey,travel
national park ramganga national park stok gompa ladakh around km south palace stok small monastery,travel
crumbling old stupa dominant feature m huge hemis gompa ladakh expansive monastery spiritual centre ladakh,travel
drukpa buddhist fifth gyaling drukpa founded hemis thiksey gompa ladakh glorious thiksey gompa one ladakh,travel
biggest recognisable monastery photogenically cascading raised rocky promontory panna tiger reserve madhya pradesh chhattisgarh tiger,travel
making comeback reintroduced  panna tiger reserve madhya pradesh reserve thought kuldhara village jaisalmer abandoned,travel
village km west jaisalmer km south sam road abandoned paliwal brahmin inhabitant like area sam,travel
sand dune jaisalmer silky sam dune km west jaisalmer along good sealed road one popular,travel
excursion city km long dune jagannath mandir puri mighty temple home jagannath lord universe incarnation,travel
vishnu built present form  temple closed bandhavgarh tiger reserve madhya pradesh chhattisgarh reason visiting,travel
tiger reserve india see tiger look couple day bandhavgarh net wah tea estate himachal pradesh,travel
one kangra valley oldest tea estate wah continuously cultivating since  visit let walk tea,travel
gir national park gujarat diu sunlight filter leaf shadow skittle undergrowth suddenly silence broken aina,travel
mahal kachchh kutch beautiful palace built  part darbargadh palace complex lost top storey,travel
earthquake lower floor open jaisalmer fort jaisalmer jaisalmer fort living urban centre  people residing,travel
within wall honeycombed narrow winding lane lined amber fort eastern rajasthan magnificent fort comprises extensive,travel
palace complex built pale yellow pink sandstone white marble divided four brihadeeshwara temple thanjavur tanjore,travel
come twice morning granite begin assert dominance white dawn sunshine evening tiger reserve maharashtra one,travel
best place see tiger india tiger reserve km south nagpur much accessible amritsar southeast end,travel
golden temple complex enormous dining room estimated pilgrim come eat every kumbhalgarh rajasthan one many,travel
fort built rana kumbha r mewar reached greatest extent isolated fort derelict palace yungdrung gompa,travel
ladakh lamayuru gompa one photogenic buddhist monastery ladakh behind glass within gompa main prayer hall,travel
tiny mehtab bagh agra park originally built emperor babur last series  park yamuna east,travel
bank long taj conceived fell best thing scale india staggering begin magical country worry done,travel
planning list top thing thing know india overwhelming size diversity lot visitor make easier tip,travel
need know go transportation sheer scale india overwhelming find way around tip train ticket bus,travel
service accessible transportation visa requirement india incredible country much offer traveler ensure breeze across border,travel
guide visa requirement money cost india one affordable country world visit make money go even,travel
budget friendly tip traveling kid incredible sight sound smell india mean little one never bored,travel
long best visit india tot tow best road trip vast expanse india infinite incredible experience,travel
awaiting beautiful nation schedule one top road trip accessibility led planet abled people various disability,travel
without disability travel side side experience real india let local expert craft dream trip filter,travel
interest interest destination practicality dec    min read india incredible country much offer,travel
traveler ensure breeze across border guide visa requirement dec    min read dec,travel
min read dec    min read dec,travel
min read dec    min read dec    min read dec,travel
min read dec    min read dec,travel
min read partnership getyourguide get heart india one guidebook covering map itinerary expert guidance explorer,travel
everywhere  lonely planet red venture company right reserved part site may reproduced without written,travel
permission english thomas pickard stocksy united greece ancient ruin piercing blue sky balmy aegean lapping,travel
endless coastline culture alive passionate music wonderful cuisine activity experience real greece let local expert,travel
handle planning mystras lakonia spread steep mountainside surrounded verdant olive orange tree former byzantine capital,travel
fortified city single ancient mycenae argolis hilltop backed powerful mountain stand sombre mighty ruin ancient,travel
mycenae home agamemnon legendary king commanded palace knossos knossos crete famous historical attraction palace knossos,travel
grand capital minoan crete located km south city iraklio sanctuary apollo delphi serving heart ancient,travel
delphi hillside sanctuary apollo pilgrim would journey hear prophecy god apollo ancient olympia peloponnese olympic,travel
game took place every four year  year abolition emperor theodosius ad  acropolis museum,travel
acropolis area dazzling museum foot acropolis southern slope showcase surviving treasure collection cover archaic period,travel
parthenon acropolis area designed monument acropolis parthenon epitomises glory ancient greece meaning apartment acropolis acropolis,travel
area acropolis important ancient site western world crowned parthenon stand sentinel athens visible olympia archaeological,travel
museum peloponnese superb museum feature find adjacent archaeological site olympia visiting conjunction ruin help put,travel
ancient agora athens agora ancient athens heart lively hub administrative commercial political social activity socrates,travel
expounded philosophy tower wind athens pentelic marble tower within roman agora likely built nd century,travel
bc beautiful functional devised andronicus kastro medieval village monemvasia almost wholly surrounded ocean monemvasia fortified,travel
medieval village divided lower town bisected main cobbled street lined byzantine christian museum athens outstanding,travel
museum based  villa ilissia offer exhibition hall underground crammed religious art exhibit palace knossos,travel
knossos crete famous historical attraction palace knossos grand capital minoan crete located km south city,travel
iraklio falasarna hania province broad sweep beach sand teal water known stunning sunset along superb,travel
water clarity sanctuary apollo delphi serving heart ancient delphi hillside sanctuary apollo pilgrim would journey,travel
hear prophecy god apollo northern pindos national park epiros north ioannina large protected area includes,travel
region around plunging vikos gorge valia kalda forest north vergina royal tomb museum macedonia tumulus,travel
burial mound converted truly museum visitor descend unspoiled royal national archaeological museum athens housing world,travel
finest collection greek antiquity enormous neoclassical building museum one athens top attraction acropolis acropolis area,travel
acropolis important ancient site western crowned parthenon stand sentinel athens visible elafonisi hania province tucked,travel
crete southwestern corner symphony fine sand turquoise water gentle rose dune look like magical dreamscape,travel
epidavros argolis day epidavros km east nafplio famed revered across mediterranean place miraculous healing visitor,travel
came great temple demeter naxos km south village sangri rather unsympathetically restored bc temple demeter,travel
ruin reconstruction mystras lakonia spread steep mountainside surrounded verdant olive orange tree former byzantine capital,travel
fortified city single vikos gorge zagorohoria vodomatis water slavic root river tributary aos carved vikos,travel
gorge million year liston corfu town corfu town owes elegant photogenic liston arcade line northern,travel
half spianada neither venetian british palaio frourio corfu town rocky headland jut east corfu town,travel
topped palaio frourio already enclosed preveli beach rethymno province also known palm beach dazzling preveli,travel
one crete celebrated strand mouth kourtaliotiko gorge ancient olympia peloponnese olympic game took place every,travel
four year  year abolition emperor theodosius ad  roman agora athens city market area,travel
roman rule occupied much larger area current site border see lot outside museum cycladic art,travel
athens st floor exceptional private museum dedicated iconic minimalist marble cycladic figurine dating  bc,travel
bc acropolis museum acropolis area dazzling museum foot acropolis southern slope showcase surviving treasure,travel
collection cover archaic period ancient mycenae argolis hilltop backed powerful mountain stand sombre mighty ruin,travel
ancient mycenae home agamemnon legendary king commanded heraklion archaeological museum iraklio museum one largest important,travel
greece revamped s bauhaus building make gleaming best thing diving bottom sea hiking waterfall top,travel
thing halkidiki thing know local tip help prepare perfect trip greece transportation wondering navigate way,travel
around greek mainland island scoop flight ferry driving bus train visa requirement greece incredible destination,travel
let fear admin stop getting everything need know visa greece money cost save money trip,travel
greece cheap flight ferry train bus plus get best deal hotel food drink traveling kid,travel
greece wonderful destination local adore kid everything need know make family vacation perfect best road,travel
trip greece meant exploring ferry travel motor vehicle wealth history culture yes beach savor experience,travel
real greece let local expert craft dream trip filter interest interest activity mar,travel
min read explore ancient ruin bathe island sunset enjoy incredible food best thing greece,travel
mar    min read mar    min read feb,travel
min read jan    min read sep    min read,travel
aug    min read jul    min read jul,travel
min read jul    min read partnership getyourguide get heart greece one,travel
guidebook covering map itinerary expert guidance explorer everywhere  lonely planet red venture company right,travel
reserved part site may reproduced without written permission english image spectacular mountain desert pristine coastline,travel
oman obvious choice seeking modern face arabia still sensing ancient soul go dreaming planning trip,travel
planning option made help craft ideal itinerary mutrah souq muscat many people come mutrah corniche,travel
visit souq retains chaotic interest traditional arab market albeit jabreen castle hajar mountain rising without,travel
competition surrounding plain jabreen castle impressive sight even surfeit fortification grand mosque muscat quietly imposing,travel
outside glorious piece modern islamic architecture gift nation sultan qaboos mark th year nakhal fort,travel
oman built foundation structure tower entrance fort constructed reign imam said bin sultan al baleed,travel
archaeological park salalah atmospherically lit night ancient ruin al baleed belong trading port zafar frankincense,travel
jebel samhan viewpoint dhofar upper plateau jebel samhan suddenly end vertiginous drop  meter coastal,travel
plain barely ledge interrupt wadi ghul viewpoint jebel sham term canyon arabia wholly deserved quintessential,travel
feature oman spectacular mountain scenery short path lead rustaq fort oman two cannon mark interior,travel
courtyard enormous fort entrance alone signal former importance built top foundation grand mosque muscat quietly,travel
imposing outside glorious piece modern islamic architecture gift nation sultan qaboos mark th year wadi,travel
dawkah dhofar small reserve km north salalah protects km grove ancient frankincense tree listed unesco,travel
part nizwa souq nizwa site one oldest souqs country extensive marketplace dedicated mostly fruit vegetable,travel
meat fish wadi ghul viewpoint jebel sham term canyon arabia wholly deserved quintessential feature oman,travel
spectacular mountain scenery short path lead mutrah corniche muscat mutrah stretch along attractive corniche latticed,travel
building mosque look spectacular sunset light cast shadow across corniche dhow yard sur corniche affords,travel
picturesque view across village ayjah dhow used led safety ayjah three watchtower mark bait al,travel
radidah hajar mountain renovated yet closed visitor attractive fort much photographed perfectly framed massif nizwa,travel
fort nizwa built  year th century sultan bin saif al yaruba first imam yaruba,travel
dynasty nizwa fort famed distinctive wadi darbat dhofar popular picnic site khareef great place enjoy,travel
jebel season wadi darbat grassy plateau hill marked damaniyat island oman rocky island around hour,travel
boat ride batinah coast rich marine life make exciting destination jabreen castle hajar mountain rising,travel
without competition surrounding plain jabreen castle impressive sight even surfeit fortification wadi ban khalid oman,travel
justly famed natural beauty wadi north town al kamil make rewarding diversion bahla fort hajar,travel
mountain many year restoration bahla fort one largest oman make grand sight looming sprawling modern,travel
settlement bahla bahla pottery hajar mountain oman terracotta pot simple ribbed motif decorate entrance smart,travel
villa hotel pottery beloved vessel mutrah souq muscat many people come mutrah corniche visit souq,travel
retains chaotic interest traditional arab market albeit housed ra al jinz beach oman am possible,travel
enjoy magical bay or fee payable ra al jinz reserve visitor centre without jebel sham,travel
resort jebel sham offering cosy stone cabin bathroom veranda heater plus arab tent popular omani,travel
weekend camp close wadi ban khalid pool oman people visiting wadi ban khalid head spring,travel
collect series deep pool narrow end wadi pool mughsail dhofar oman spectacular bay end set,travel
sheer cliff reach towards yemeni border immediately start cliff balcony walk jebel sham popular several,travel
route jebel sham km hike direction requires nerve m drop best thing oman country arabian,travel
peninsula famed long coastline high mountain rugged canyon top thing thing know traveler multimedia gallery,travel
creative wine bar design shop tech experience real paris let local expert handle planning eiffel,travel
tower paris different way experience eiffel tower daytime trip evening ascent amid twinkling light meal,travel
one centre pompidou paris home europe largest collection modern contemporary art centre pompidou amazed delighted,travel
visitor ever since opened  paris visit sunny day paris oldest finest stained glass dazzling,travel
