text,label
best chapel famous muse du louvre paris standing vast courtyard louvre glass pyramid ornate faade,travel
truly say paris le catacombes paris gruesome ghoulish downright spooky never fails captivate visitor,travel
subterranean tunnel abandoned quarry muse rodin le invalides even art lover worth visiting art museum,travel
lose romantic garden jardin du luxembourg le invalides famous oasis formal terrace chestnut grove lush,travel
lawn special place parisian heart panthon latin quarter elegant regal equal measure massive neoclassical dome,travel
left bank iconic panthon icon parisian skyline louis muse orsay le invalides muse orsay may,travel
quite famous located mere walk left bank museum hold le grand rex paris blockbuster screening,travel
concert aside  art deco cinematic icon run tour english soundtrack available le printemps paris,travel
famous department store le printemps encompasses le printemps de la mode woman fashion le printemps,travel
de la beaut et maison beauty muse du louvre paris standing vast courtyard louvre glass,travel
pyramid ornate faade truly say paris bar hemingway paris photo memorabilia hunting trophy old typewriter,travel
framed handwritten letter great writer fill snug bar paris seine paris idea gently rocked sleep,travel
take fancy check paris first floating hotel sleek parc de butte chaumont montmartre northern paris,travel
butte chaumont one city largest green space landscaped slope hiding grotto waterfall lake even island,travel
topped le rsistants montmartre northern paris natural oak marble stone blend seamlessly profusion wicker lampshade,travel
green foliage wildly popular muse marmottan monet paris museum showcase world largest collection work impressionist,travel
painter claude monet  well painting arc de triomphe paris anything rival eiffel tower symbol,travel
paris magnificent  monument napolon victory austerlitz  le trs particulier montmartre northern paris clandestine,travel
cocktail bar boutique htel particulier montmartre entrancing spot summertime alfresco cocktail cocktail place de vosges,travel
le marais mnilmontant belleville inaugurated  place royale thus paris oldest square place de vosges,travel
strikingly elegant ensemble  symmetrical house jardin du luxembourg le invalides famous oasis formal terrace,travel
chestnut grove lush lawn special place parisian heart montmartre northern paris tasty buzzword second outpost,travel
le rsistants former wig shop earthy e fresh seasonal produce basilique du montmartre northern paris,travel
begun  wake war chaos paris commune symbol former struggle eiffel tower paris different way,travel
experience eiffel tower daytime trip evening ascent amid twinkling light meal one muse de l orangerie,travel
paris monet extraordinary cycle eight enormous decoration de nymphas water lily occupies two huge oval,travel
room  jardin du palais royal paris jardin du palais royal perfect spot sit contemplate,travel
picnic boxed hedge shop trio beautiful arcade szane montmartre northern paris fashionistas needed confirmation northern,travel
paris quartier place iconic fashion brand szane galeries lafayette paris department store galeries lafayette spread,travel
across main magnificent dome date  chez alain miam miam le marais mnilmontant belleville weave,travel
way makeshift kitchen inside march de enfants rouge find alain retired baker sporting attitude march,travel
aux puce de montmartre northern paris spanning nine hectare vast flea market founded  said,travel
europe largest  stall grouped  marchs place de la concorde paris paris spread around,travel
view eiffel tower seine along stand city largest square cire trudon le invalides claude trudon,travel
began selling candle  company officially supplied versailles napolon light world march de enfants rouge,travel
le marais mnilmontant belleville built  paris oldest covered market secreted behind inconspicuous green metal,travel
gate glorious maze food stall selling le perchoir marais le marais mnilmontant belleville paris original,travel
rooftop bar run talented mixologist behind le perchoir e trendy sky deck languishing atop department,travel
store bhv canal montmartre northern paris tranquil canal inaugurated  provide shipping link seine paris,travel
northeastern suburb grande arche de la dfense paris la dfense landmark edifice marble grande arche,travel
arch built s house government business office arch mark le mary cleste le marais mnilmontant,travel
belleville snag stool central circular bar eternally fashionable cocktail bar reserve one handful table fluctuart,travel
le invalides opened  hip cultural centre occupying pniche barge pont de invalides brought unexpected,travel
dash coolness le pavillon puebla montmartre northern paris folk running hugely successful rooftop bar le,travel
perchoir also behind enchanting du bonheur temple happiness jardin de tuileries paris filled fountain pond,travel
sculpture formal tuileries garden begin west jardin du carrousel laid cimetire du pre lachaise le,travel
marais mnilmontant belleville opened  pre lachaise world visited cemetery ornate tomb rich famous form,travel
verdant avenue de paris trip paris complete without strolling broad avenue lined luxury shop named,travel
elysian field heaven ducasse sur seine paris launched chef alain ducasse restaurant ducasse sur seine,travel
sail city past icon louvre le perchoir le marais mnilmontant belleville sunset best time hit,travel
iconic bar drink overlooking paris rooftop saturday night dj set fondation jrme paris striking cinema,travel
small exhibition devoted history cinema screen silent b w movie accompanied live pianist path arnes de,travel
lutce latin quarter roman amphitheatre lutetia arena seated people gladiatorial combat event found accident,travel
parc de butte chaumont montmartre northern paris butte chaumont one city largest green space landscaped,travel
slope hiding grotto waterfall lake even island topped cit de science et de montmartre northern,travel
paris paris top museum kid host exhibit child aged two cinema la gode planetarium march,travel
mouffetard latin quarter grocer butcher fishmonger food purveyor set good street stall market many stall,travel
close parc monceau montmartre northern paris marked neoclassical rotunda main bd courcelles entrance beautiful parc,travel
monceau sprawl lush hectare laid parc de la villette montmartre northern paris spanning  hectare,travel
vast city park cultural centre kid playground landscaped urban space intersection two canal parc de,travel
belleville le marais mnilmontant belleville atop hill m sea level lovely park unfolds hectare urban,travel
greenery fountain trimmed hedgerow gargantuan slide cimetire du montparnasse paris cemetery opened  paris second,travel
largest pre lachaise famous resident include guy de maupassant muse art moderne de la ville,travel
de paris paris permanent collection paris museum display work representative every major artistic movement th,travel
nascent muse rodin le invalides even art lover worth visiting art museum lose romantic garden,travel
basilique du montmartre northern paris begun  wake war chaos paris commune symbol former struggle,travel
muse de la vie romantique montmartre northern paris framed green shutter mansion painter ary scheffer,travel
lived sits cobbled courtyard end alley promenade plante paris disused vincennes railway viaduct reborn,travel
world first elevated park planted fragrant profusion march aux puce de montmartre northern paris spanning,travel
nine hectare vast flea market founded  said europe largest  stall grouped  marchs,travel
muse cernuschi montmartre northern paris recently renovated cernuschi museum comprises excellent rare collection ancient chinese,travel
art funerary statue bronze ceramic much parc du champ de mar paris running southeast eiffel,travel
tower grassy champ de mar ideal summer picnic spot originally used parade ground cadet philharmonie,travel
de paris montmartre northern paris silver bird flutter across dazzling metal faade paris futuristic philharmonic,travel
striking piece contemporary architecture within cit canal montmartre northern paris tranquil canal inaugurated  provide,travel
shipping link seine paris northeastern suburb centre pompidou paris home europe largest collection modern contemporary,travel
art centre pompidou amazed delighted visitor ever since opened  atelier brancusi paris northwest main,travel
building centre pompidou reconstruction studio sculptor constantin brancusi cimetire du pre lachaise le marais mnilmontant,travel
belleville opened  pre lachaise world visited cemetery ornate tomb rich famous form verdant cathdrale,travel
notre dame de paris paris interior closed visitor following devastating fire april  masterpiece french,travel
gothic architecture remains march aligre paris favourite chef local chaotic street market stall piled fruit,travel
vegetable seasonal delicacy truffle thing know plan visit paris top tip etiquette health safety know,travel
something go wrong best neighborhood paris made  different city district called arrondissements distinct charm,travel
get know handy guide day trip hard anyone leave paris day trip offer bucolic nature,travel
gorgeous cathedral hour away money cost savvy planning bit local find wealth way enjoy paris,travel
without blowing budget top tip transportation walking best way explore paris individual neighborhood need bus,travel
metro rer go afield free thing paris rightfully known expensive way squeeze budget favorite free,travel
thing paris traveling kid whether traveling paris baby toddler tweens help find right activity keep,travel
whole family happy  shop discover architectural jewelry local design vintage find tiny treasure paris,travel
independent shop market experience real france let local expert craft dream trip day trip apr,travel
min read hard anyone leave paris day trip offer bucolic nature gorgeous,travel
cathedral hour away mar    min read mar    min read,travel
mar    min read mar    min read mar,travel
min read feb    min read jan    min read,travel
nov    min read oct    min read partnership getyourguide get,travel
heart paris one guidebook covering map itinerary expert guidance explorer  lonely planet red venture,travel
company right reserved part site may reproduced without written permission english sol de zuasnabar image,travel
instantly recognizable icon like big ben st paul cathedral welcome london uk multicultural capital tireless,travel
innovator art culture experience real london let local expert handle planning westminster abbey west end,travel
splendid mixture architectural style westminster abbey considered finest example early english gothic merely beautiful tate,travel
modern south bank one london amazing attraction tate modern outstanding gallery housed creatively revamped natural,travel
history museum kensington hyde park thunderous animatronic dinosaur riveting display planet earth outstanding darwin centre,travel
architecture straight gothic st paul cathedral london sir christopher wren architectural masterpiece london icon towering,travel
diminutive ludgate hill superb position tower london london part uk steeped history impregnated legend superstition,travel
titanic stonework tower london shakespeare globe south bank seeing play shakespeare globe ideally standing wooden,travel
experiencing playwright work best british museum west end almost six million visitor trooping door annually,travel
british museum bloomsbury one oldest finest museum world hyde park kensington hyde park one london,travel
best park hyde park spread  hectare neat garden wild expanse overgrown grass glorious tree,travel
well london eye south bank hard imagine south bank without london eye officially named london,travel
eye current sponsor world kensington garden kensington hyde park delightful collection manicured lawn avenue basin,travel
immediately west hyde park picturesque expanse kensington garden kensington palace kensington hyde park built,travel
kensington palace became favourite royal residence william mary orange  remained george iii yard west,travel
end soho favourite attracts good bad beautiful fairly perfect drink science museum kensington hyde park,travel
science museum mesmerize interactive educational exhibit covering everything early technology space travel take ye olde,travel
cheshire cheese london rebuilt  great fire one london famous crowded pub strong literary connection,travel
mark twain french house west end legendary bohemian boozer quite history meeting place free french,travel
force wwii de gaulle said lamb flag west end perpetually busy lamb flag full charm,travel
history public house since least  known bar terminus west end cool assured expertly staffed,travel
tiny soho perfect negroni speciality house cocktail mostly coffee albert memorial kensington hyde park splendid,travel
victorian confection southern edge kensington garden ostentatious subject queen victoria humble st james palace west,travel
end striking tudor gatehouse st james palace surviving part building initiated henry viii  soho,travel
west end district pastureland name soho thought evolved hunting cry centre london nightlife big ben,travel
west end famous feature palace westminster house parliament elizabeth tower commonly known big ben major,travel
shakespeare globe south bank seeing play shakespeare globe ideally standing wooden experiencing playwright work best,travel
westminster abbey west end splendid mixture architectural style westminster abbey considered finest example early english,travel
gothic merely beautiful shard south bank puncturing sky london dramatic form shard become icon city,travel
one tallest building museum london docklands east london housed  warehouse educational museum combine artefact,travel
multimedia display chart history city river changing guard west end pageantry soldier uniform bearskin hat,travel
parading mall buckingham palace madly popular buckingham palace west end built  duke buckingham palace,travel
replaced st james palace monarch official london residence  queen hyde park kensington hyde park,travel
one london best park hyde park spread  hectare neat garden wild expanse overgrown grass,travel
glorious tree well white horse west end lovely pub busy corner soho white horse tick,travel
box friendly staff cheap drink part sam smith brewery empire st paul cathedral london sir,travel
christopher wren architectural masterpiece london icon towering diminutive ludgate hill superb position natural history museum,travel
kensington hyde park thunderous animatronic dinosaur riveting display planet earth outstanding darwin centre architecture straight,travel
gothic british museum west end almost six million visitor trooping door annually british museum bloomsbury,travel
one oldest finest museum world house parliament west end elected house common house lord appointed,travel
hereditary sit sumptuous house parliament officially royal albert hall kensington hyde park built  thanks,travel
part proceeds  great exhibition organised prince albert queen victoria husband huge domed tower london,travel
london part uk steeped history impregnated legend superstition titanic stonework tower london tate modern south,travel
bank one london amazing attraction tate modern outstanding gallery housed creatively revamped borough market south,travel
bank thousand year market existed southern end london bridge making ancient gathering point superb victoria,travel
albert museum kensington hyde park museum manufacture v known opened  part prince albert legacy,travel
nation aftermath southbank centre south bank southbank centre europe largest space performing visual art made,travel
three brutalist building stretch across seven natural history museum kensington hyde park thunderous animatronic dinosaur,travel
riveting display planet earth outstanding darwin centre architecture straight gothic tate modern south bank one,travel
london amazing attraction tate modern outstanding gallery housed creatively revamped serpentine gallery kensington hyde park,travel
gallery one london important gallery damien hirst andreas gursky louise bourgeois gabriel orozco victoria albert,travel
museum kensington hyde park museum manufacture v known opened  part prince albert legacy nation,travel
aftermath william morris gallery london fan victoriana art craft movement make time sensational little gallery,travel
beautiful georgian mansion located covent garden piazza west end london wholesale market  mostly preserve,travel
visitor flock shop among quaint royal observatory greenwich rising like beacon time atop greenwich park,travel
royal observatory home prime meridian longitude   ticket include access king cross station north,travel
london clean line simple arch twin train shed might forgiven thinking king cross modern building,travel
harry potter shop platform  north london pottermania refuse die diagon alley remains impossible find,travel
junior witch wizard seeking wand sky garden london fern fig tree purple african lily clamber,travel
final three storey talkie skyscraper mere wallflower hampstead heath north london sprawling hampstead heath rolling,travel
woodland meadow feel million mile away city despite mile st pancras renaissance hotel london north,travel
london housed former midland grand hotel gothic victorian marvel designed sir george gilbert scott,travel
st pancras saatchi gallery kensington hyde park grandly housed gallery duke york headquarters host temporary,travel
exhibition experimental work across variety kenwood house north london magnificent neoclassical mansion stand northern end,travel
hampstead heath glorious sweep landscaped garden lead leake street arch south bank grungy road waterloo,travel
station seems unlikely,travel
